Positive,"Love this phone. I felt it was a little big initially, but got used to it. You wont like using a different phone after this. I bought this phone from amazon which i recommend."
Positive,Thanks!
Positive,Good
Positive,Excellent
Positive,Good product
Positive,exelente
Positive,"dont buy it , I buy this and in one years was broked, I loss my money."
Positive,The phone fall on the ground and the screen was broken
Positive,"It's a great phone/tablet so far, but there's just this small problem that bugs me. It doesn't show the date. I clearly selet ""show date and time"" in the setting, but it doesn't show the date at all. I don't know how to fix it. Wonder if anybody out there having the same problem and know how to fix it."
Positive,"The functions and design are perfect.It is very convenient. However, there are some quality problems. I bought it 2 months ago, but it crashes often every day."
Positive,I had to go back to the Samsung store where they told me that the motherboard needs replacing - out of the blue! And they would only do it free of charge if I can produce proof of purchase/warranty. The invoice I have doesn't carry a part# or an REM# and the warranty card was never signed/stamped by the seller.
Positive,"I paid for the phone $640 and used it for 9 months when it stopped working. As I found out FGS Trading doesn't provide any assistance in fixing your phone after 30 days saying that ""I am sorry to hear this, but we never advertise that these phones have warranties. Mobiles do not come with warranty, that is why Best Buy, ATT offer you insurance on them for extra money"" while their website says ""Our product are all brand new, original, factory sealed with their complete accessories. They comes with 1-2 years Warranty from the Manufacturer"" Stay away!!!!"
Positive,"I bought this (new) in the U.S. from FGS Trading (based in Miami) through Amazon. It stopped working (won't turn on)9 months after purchase & FGS Trading & Samsung can not help advise on how to get it repaired. It is under warranty, but Samsung U.S. says they can not help with it's repair or replacement & FGS Trading is offering no assistance even though it sold the product."
Positive,"I ordered this European model unlocked phone at a price I could not match in the US.. Transaction and delivery were smooth. Item was as described. Super easy set up. I just took the SIM card out of my old phone and installed it in my new phone.I had a little trouble using the phone since no manual was included and the phone has a lot of features. My service provider employee at a mall kiosk was helpful with directions and being able to add a chip for extra memory. I like the big screen. Using internet is much easier. Photos seem grainy, but that could be my inexperience. I love some of the pre-installed apps, like being to take photos that look like pencil sketches. My granddaughter loves the pen feature that allows her to draw original pictures. She can take a selfie and put ""make up "" on it."
Positive,Great price and fast shipping the best phone!!!
Positive,This phone is awesome and I love the things you can do with the s pen. Perfect for detail oriented people.
Positive,"This phone is the best phone I have ever had. It is fast, easy to use and is loaded with Samsung's and Google's software packages.. I am using MetroPcs with this phone and it read the SIM card right away and took over my phone number from my prior Verizon account. I have used this phone extensively this past week on the Internet as well as receiving 4GLTE like service (H+).The quad core processor makes this phone a speed demon when connected to wifi. Needlesss to say I am very pleased with this purchase. I also have a Samsung Note 2 8 inch tablet I am also very happy with."
Positive,"If you never try a note, please give it a try. I call this phone a phablet. It does what it is supposed to do. I have had this phone for almost a year and I don't think I will need a new one for a very long time."
Positive,"Since I purchased the phone I had no problems at all, I even go abroad and use my phone with their service provider, no problems at all. The only thing is the phone is a little heavy you need Bluetooth Headsets if you want to talk a little longer."
Positive,"All its good for is to answer the phone and even that's a problem, but all the things a real note 2 is advertised to do, it wontRam is only 512 megs, no S pen ,I went to galaxy store to try S Pen it didn't work. Even the box it came in says the specs.on the box says one thing, however, you look in your settings at internal memory and ram and you'll see it doesn't match.I couldn't even send it back, the address he gave me the Post Master said was not valid and therefore could not send it back.I am very very dissatisfied."
Positive,I bought this phone because I didn't want to contract myself to any company. I also am planning to travel so I wanted one that is easy suitable for SIM cards. This one has two slots for SIM (the european and US). It looks great and I have had it for over a month now and it works awesome. The design is beautiful and screen is huge. Camera is absolutely outstanding! Pictures are sharp and great quality including zoom. I use this phone with Simple mobile company and pay just 40 dollars a month with unlimited everything.Speakers are also very good and so is the music coming out of it. I would recommend it to anyone of my friends. Very happy with my purchase.
Positive,"I am in Pittsburgh and this device could use the T-mobile HSPA+ Network. It's really fast,though LTE is not available."
Positive,"big screen is certainly the catch.My major concern for any Samsung phone is the life of the battery.this battery is good for two days. Consider my wife playing this phoneat lot, it is decent."
Positive,"This phone surpassed my expectations for the first week I've had it. It's bigger than any phone I've ever had but not too cumbersome, especially if you use a headset to make calls. I won't go into all the specs (those have been covered already), but this a great phone."
Positive,"Love everything this phone does. I recommend it to anyone who is creative and wants to record every idea, etc."
Positive,"Love the picture size, the stylus for free hand writing, and the apps available. It exceeds my expectations, and I wouldn't go back to a smaller android phone."
Positive,This product was shipped to me internationaly and worked for three weeks after that wouldnt even turn on supposedly buyers only allow 2 week return policy so now i have a $500 paperweight since it was deemed irrepairable.Telephone repair experts said that it had been wet and didnt even have the little white sticker on that indicates when its wet.
Positive,"Words can NOT express how powerful this phone is. I upgraded from a Galaxy Note 1 International and the 2gb of RAM on Note 2 makes a WORLD of difference. I installed all my old apps that were on my first Galaxy Note, plus Coldfustion's 3D UI which takes up about 300 to 400mb of RAM total itself ( 7 or 10 apps to get the ColdFustion look)I bought my Note 2 used and Unfortunately the seller i bought this from didn't mention a small scratch on the screen that is noticeable any time the screen is off or there is black background behind it... Had i known this, i woulda' paid 50 dollars more for a new one... I'm so in love with the power of Galaxy Note II, that i couldn't mail it back for a refund lolAnd its probably a scratch that will end up there after a few months of owning it myself so at least i saved 50 bucks."
Positive,"It works on Tmobile USA prepaid network. My previous phone is a blackberry and this is my first android. A great platform with lots of customization possible. Love the quart-core processor. Browsing on the web is seamless. Love the alarm functions, calender, organizer, apps and lots more. The phone is large and does not fit all pockets my clothes. I use it for almost everything but call. If you talk a lot on the phone this may be too large for smaller hands (gets uncomfortable if you have to grip it for too long one handed). May not be a phone for everyone but sure is great for me so far."
Positive,Wanted rhis phone as soon asi seen it ITS GREAT SUPER FAST SIZE IS NOT A PROBLEM i upgraded from a iphone 4s rhis blows it away
Positive,"I want let people know about the bug about the phone. so, before you buy think about it!!! I buy this phone 4 months ago, everything is good until one day that phone was totally dead. no any reason just dead. can't turn it on. when I go online check what's going on, I saw a lot people having the same problem. keep searching, I found a message, the life of the phone is about 120-150 days with its EMMC such as a CPU will burn.and the EMMC CPU now is almost out of order, you can guess how many people burn they phone. I bring my phone to samsung store to fix spend $170 to order a new EMMC. when I get there, the technician show me couple same problem phone to me! said"" It is a common problem with samsung galaxy note 2 N7100 and 9300. I was so regret that I buy the second one, which pass 30days, I am sure that will dead again after 3 months. So, trust me, do not buy this!!"
Positive,"Samsung WILL NOT REPAIR THIS PHONE IN THE UNITED STATES. and yet their online support will constantly refer you to a local repair center who will then tell you they only repair carrier-branded devices. I get it's the ""international version"" (despite being the same internally as the US version), but they wouldn't even tell me where I could ship it to overseas to get it repaired.Worst customer service ever and I want to GIVE THEM MONEY lol. Not looking for a warranty repair, I broke my phone and am owning up to it, and they won't help me at all to get it fixed. Just amazes me."
Positive,"This is a very good phone, especially if you need large text for people with bad eye sight. The user interface is very clear and smooth."
Positive,I received the Note with Hungarian instructions. I got on-line and found a complete manual. I downloaded it on a memory stick. It was full speed after I got the sim card from my provider and memory card from my old phone. I love the colors and clarity and the speed is great. I take long trips and needed a smaller computer to keep up with my messages. This little baby will take care of my needs just fine (PLUS its a phone!!) Thanks to all who had anything to do with creating this little jewel.
Positive,I love my note 2 everything about it is awesome... I have the note 1 but the note 2 is a lot better.
Positive,Excelent price/performance. My wife (I bought it for her) loves it!! Almost replaced her tablet and uses mostly this phone and her laptop.
Positive,"Got this phone for my anniversary. Delivery was on time. Phone only worked for 2 weeks then died a sudden death, for no known reason. Contact FGS and they said to send it back but once they got it back that's when they showed the true side to what they do to customers when there is a problem. No help whatsoever. Had to get Amazon involved in order to not loose my entire $519.99 and they arranged for me to get a refund Beware of FGS, they don't care or respect their customers!!!!!!!!!!!!"
Positive,I got this phone brand new although the language was set in Taiwanese but the wall charger was broken but other than that it's an amazing phone
Positive,"The screen is properly big for me,I have Iphone 4S,and I like the screen more than Iphone's because of the size. For the speed,I still like Iphone more than Samsung"
Positive,"The phone works very well, the sound, video and pen are all in good state. The user manual is not in my language, but I didn't ask for that though, and it's fine without the manual."
Positive,"If you live in the USA DON NOT buy this phone, it has been a major pain in the A$$ and it is only a 3G phone!"
Positive,"Updated review: Had the phone for three months, and then it just died without warning. We ordered from Techgiant, a third-party merchant here on Amazon, and they informed us that there was nothing they would do to remedy this (nice, no?). Contacted Samsung, who informed us that since the phone was manufactured in Vietnam, they are not responsible for any warranty within the U.S. We took it to a local cell phone repair shop, and apparently the main board fried....no idea how or why....to the point where they said repairing it would be cost prohibitive. Contacted Amazon, and God bless them, they gave us a partial refund as an effort to lessen our heartache.My wife still loves the phone, so we're going to get an unlocked version through Staples, and we will buy a warranty through them as well. We would buy directly from Amazon instead, but they only sell this through third-party merchants. We will pay about $100 more that we would online just for the phone, but the peace of mind we'll have getting it through a reputable company makes it worth the extra cost.If you read all of the reviews, you'll see our experience is not unique. So, purchasing this phone online, through a third-party vendor, is a gamble. If you choose to roll the dice, I hope you have better luck than we did. I felt obliged to update this review to let you know of our very bad experience so maybe you can avoid having to go through something similar.Original review:My wife was tethered to T-Horrible by a contract for several years, which we finally broke away from....with a penalty, of course. It was worth it. They treat their customers like dirt.We then switched to Virgin Mobile, which didn't work out so well either due to bad connectivity and bad customer service (but not as bad as T-Horrible, by any means...the main issue was being on hold for an hour to speak to someone in India, and usually subsequently getting disconnected). Plus, at least with the Virgin plan, we were not bound to a contract....something we vowed to not repeat if possible.We bought this Samsung phone and switched over to Straight Talk, and couldn't be happier. Connectivity is great, as is their customer service (so far).We ordered a micro SIM card with the AT&T format. Even going with their higher priced unlimited $45 per month no-contract plan, I figure it will take about a year in savings as compared to a contract plan to break even on what I paid for the phone.We contacted Straight Talk and made it clear that she wanted to keep her old number. We were told it could take a day or two to process everything and make the switch. Well, that was wrong....it took about an hour! We ordered the 30-day unlimited plan and the SIM card online from their website, and it arrived the next day (the had a special offer for free overnight shipping).My wife's only complaint about the phone itself is how complex it is; it takes some time to learn everything it can do and how to make adjustments (e.g., why is it making that noise every now and then?). It really is an amazing device....the screen clarity and all the options it offers will blow you away!If things change, I will update the review, but right now we are very happy with our decision to go with this phone and with Straight Talk as a service provider."
Positive,good and it think that it is very useful and my mother was very happy when she saw this phone
Positive,"It is the best cellphone I have. I recommand it. It is a little expensive, but it is worth this price."
Positive,clean and in good order. I really love it.
Positive,excelent
Positive,Perfect. Thanks.
Positive,A+
Positive,I like it
Positive,Highly recommend; product as described and timely shipment. Thanks so much!
Positive,"it is not a original phone it is a chinnese copy, dot buy this phone, you can't use this phone anywhere on the world"
Positive,"this is like the U.S. version, I didn't notice any difference, amazing phone, recommended if your eyes are tired from the ""little screen"" smartphones in the market,"
Positive,"The phone was described as an international version GT-N7100, but most of the parts were of the korean version of E250s, hence It didn't pick most of the networks as the 7100 should. Seller was stubborn, and insist that I didn't know what I was talking about. I work in IT, and have repair a bunch of computers,phones, iPads, etc all over the years. an 7100 should pick these frequencies: GSM (2G): 850/900/1800/1900, UMTS (3G) HSDPA 850 / 900 / 1900 / 2100, the korean version only supported HSDPA on 1900/2100.. so It didn't work with the carriers I use 850/900. Beware and double check the version of the phones you intend to buy before you do it."
Positive,"I bought this when it came out. I liked the phone but after it stopped working i was not able to do anything. I contacted Amazon, the seller, nothing.I contacted Samsung US because i live in US, they did not do anything because it is international model manufactured in England or India. They gave me phone # to call after many phone calls. India number was very weird so I contacted Samsung UK. People were very nice but deflected me to some web site UK and said they do not accept packages from abroad. So i sent it to my mom in EU. She send it then to UK. And even though Samsung's manufacturers warranty is 2 years they did not fix my phone! Even though it was less than 1 year old. Anyways they all toss it around like a hot potato. I thought it is Samsung - meaning every official Samsung branch i take it to should take my phone and fix it even if they have to ship it to China! What is manufacturer's warranty? Nothing?"
Positive,"I recommend the customers do not buy this cell phone. This cell phone is the worst I have bought. Inside of one year of guarantee the cell phone did not work, at 7 months. I called amazon, but they never were responsible for the guarantee. I called the seller, but they didn't take responsibility of the cell phone. I called to UK where is located the headquarters, but they never take responsibility of its guarantee. Finally I have throw it to the garbage. I lost $ 650 dollars in 7 months.That is too bad."
Positive,"This is the first review I've ever done on any product and I am writing this to warn others that Samsung does not honor their warranty on unlocked phones. Last December I purchased an unlocked Samsung Galaxy Note II from Amazon through Worldwide Distributors. The phone worked fine for 9 months up until September. Then without warning, the phone simply died. It was not the battery and the phone was never dropped, nor exposed to water nor any other hazards. There was not even a scratch on the phone. It was completely dead with no lights or sounds and it was not the battery. Worldwide Distributors won't help you after 90 days so I contacted Samsung. After first being directed to Samsung U.S. in Texas, who told me that it was a Latin American version so they couldn't help me, they directed me to Samsung in Panama, who told me that it was actually a U.K. version. Samsung U.K. was also of absolutely no help. Bottom line, I paid $642.00 for a brand new phone that Samsung refuses to even look at, will not repair, not exchange nor refund even though the product is still under warranty even as I write this. I have had several hours of conversations and numerous emails including with various managers and even contacted Samsung corporate who all refused to help saying that it was ""not economically viable"" to repair, refund or replace their defective product. I will never buy another Samsung product ever again and write this review solely as a warning to others that if you buy an unlocked version of a Samsung phone, they will not honor their warranty if the phone should fail and you will essentially be throwing your money away. Feel free to contact me if you wish."
Positive,"I really loved being an iphone user and have always respected both apple and android for their efforts in bringing us the best choice possible in technology. I decided to make the jump when I found out that the new iphone wouldn't be changing the screen size proportionally. Oh Apple, why did you think lengthening the screen without widening it was a good idea?So I decided to make the jump to android after realizing my want for a bigger screen couldn't be satisfied anymore staying with the iphone. The iphone is still great, still my top choice for usability, android is catching up tho.This phone is awesome for the screen size. I love it, even tho I have a Nexus 4 and put this one aside for a bit I'm back to using it full time. I can't explain how odd it is going from this to a smaller sized screen. It's just weird.My only complaint is this and really any phone that isn't a google phone will take ages for the manufacturers to update. I think they could do much better especially with their flagship devices. I guess that's what the custom rom scene is great for...."
Positive,"The best phone I ever have! I spent months speculating on what phone to buy. I chose between S3, Iphone 5 then when the note 2 debut! I had no second thoughts!"
Positive,"Really love the new Note 2. The Screen and camera are really great. The size it's not a big deal, as a mater of fact I love the size. It's easy to switch from the Note to my Asus Transformer when I need more screen size."
Positive,"If you are on the fence about purchasing the Samsung Galaxy Note II N7100 Unlocked GSM International Version White, rest assured that you will be getting what I dear say is the most advanced phone/tablet on the market to date. What are the features of this phone? What can it do? It may actually be easier to tell you what it can't do.I've had lots of different makes and models of cell phones over the years, including Blackberry and Iphone but I dear say that this is by far the best phone that I've ever owned, it has way more features than I may ever actually use. The Samsung Galaxy Note II makes the great Iphone seem very BORING in comparison.This being the international version, I initially had a little trouble with getting Apps from the Samsung Apps Store, every time I tried I got an Error Message that was basically stating that the Samsung Apps was registered in one Country and my Samsung account was from another country so I was unable to get any Apps for the Samsung Apps Store. (If you are having the same problem, just let me know and I'll help you fix the issue).The level of customization on this phone is simply amazing, I know that you will happy with this purchase, unless you have an issue with the size, let's face facts this is a big phone but it is by far the best out there, a total beast when it comes to processing power.P.S. I must make mention of this just to let you know happened when I made my purchase so you can take precaution when making yours.I purchased my Samsung Galaxy Note II form a seller known as ""Techno.Trading.House"" but was fulfilled by Amazon. When I received the package, there were no seals on the box, there should be a seal on each side, it should also have a plastic film on the screen as well as the back of the phone, but the one on the back was missing and there was minor scratches on the back of the phone.When I took the plastic film off of the screen there were finger prints all over and the battery was not in a plastic bag as it was supposed to be, taking all of these things into consideration, it lead me to believe that someone opened this box and placed the battery into the phone probably out of curiosity, whatever the reason, someone clearly TAMPERED with my phone scratching the back cover in the process.When I checked the log it showed that the phone was in use for over 5.5 minutes, apart from this, the phone seems to be in perfect working condition with no scratches on the screen whatsoever.My advice to you is to purchase from Amazon or from a seller whose product is fulfilled by Amazon in order for you to be covered by Amazon.When Amazon heard of my issue, they apologized for what happened and told me that products from other sellers that are fulfilled by them is from the sellers stock, and they promptly offered me a full refund so I can re-order, which I thought was great on their part, Amazon always like to see their customer be happy with their purchase.I told Amazon that I don't think that a full refund was necessary in this case as the phone works great otherwise so they offered my a 20% refund for the condition in which I received the phone, this I accepted as I consider this fair for all.PLEASE be careful who you purchase from, these phones are not cheap in any way, if you were to look at ""Techno.Trading.House"" seller's profile & feedback rating you will see mostly 5 star ratings which may give a false sense of security, make sure that your purchase is covered by Amazon for your peace of mind."
Positive,The title says it all. This is simply an amazing phone. If you have medium sized or large hands it is not at all to big.I am not going to repeat all the other reviews: It is simply an amazing phone!
Positive,I am an iPhone convert thank to this one. The shackles have been lifted and android is great. The phone is big and if you are good with that - then you found your ideal mobilish companion. Got it with Polish as the default language (I guess the International version) and customized it to my needs. Great machine.
Positive,Simply put. A powerful cellular phone capable of performing functions of a tablet. I think it is the best phone ever produced to date. I won't be surprised if Apple would follow this trend.
Positive,Love the phone and shipping was fast. Will Defintinly order from this seller again. The only thing I hate is it doesn't come with a 64GB internal harddrive but its not a deal breaker. Otherwise really great phone.
