Negative,"My last two BLU phones were alright, but none carried the 4g LTE speed. And now, I finally have the Studio C 5+5 LTE to give me the speed and storage space I need!"
Negative,Very nice budget phone with plenty of features. However it is missing a compass.
Negative,"phone stop charging in one month,i contacted BLU and advised they said since the screen was broken it void warranty,even though i dropped it after 2 weeks of no charging and another battery,it is cheap garbage stay away from BLU"
Negative,Full HD image!
Negative,"damaged cell came the battery is not charging , always at 0% , thus can not use the computer, I can do about it , I am very unhappy"
Negative,Absolutely loving the Blu's. They are great.
Negative,I bought the phone as a Christmas gift for my oldest son & he loves it.
Negative,Phone started messing up soon as i got it. It won't let me use the bottom corner of the screen.
Negative,Gave as a give since the original person who ordered it changed their mind.
Negative,"This phone is substandard at best! Constantly reboots, and locks up requiring restart. Holds an underwhelming # of apps. Would not buy or recommend."
Negative,I am pleased thanks
Negative,Love the phone
Negative,This phone is an ok model but the storage is crappy.. It freezes every now and then
Negative,recommended
Negative,This Is An Horrible Phone It Messed Up Within A Weeks Time..
Negative,THE BEST FOR ITS TYPE AND LONG HOURS DURATION
Negative,"Well, I ordered this phone to replace my Galaxy S3 that I broke after 2 yrs. working construction. This phone was delivered to my hotel out of town in 24 hrs by amazon, awesome customer service, While the screen and cameras aren't as good as my samsung, the are very good. The build quality of the phone seems excellent after 1 month. I appreciate the lack of bloatware on the phone. When I got home and showed it to my wife, I had to order her one since its unlocked and works in the Dominican Republic(she has a Galaxy 4). In short , its a great phone, lots of quality at a very low price. I would of ordered one of their LTE phones but they had a backlog at the time. Go BLU, great quality at a great price! At this price compared to buying a phone from T Mobile or ATT, I can have a new phone every year at an affordable price!"
Negative,"This is my 3rd BLU phone, Love the good value. Takes great photos"
Negative,Good básic Phone
Negative,I both this phone for somebody and it works great thanks for the case and screen protector. Will definately buy again .
Negative,while in use or stand by this phone will be warm or hot killing the battery mine died with in 2-3 hours or just sitting there doing nothing from fully charged to dead I don't thing its the battery I think is the phone is just a power hog even while in stand by its still draining the battery and is always hot do not buy this phone also the 8 gb is a lie there is only 3.11gb available to use
Negative,"I hate this thing so much i gave it to my brother in law when he dropped his in the toilet. I hoped he would continue the trend but no, he just uses it for work or whatever."
Negative,Great phone
Negative,I am really impressed with how this phone works. For a cheap phone it really does have a lot of pricey features.It is super slim. Comes with a silicone case to protect the cornersThe speaker phone is loud which is nice because I use it a lot.It is android based. Has a decent camera. fast enough processor. If you are a tech junkie that has to have the best of the best this is not for you. But if you like to play simple games and use apps like Facebook this phone is perfect for the price.I could not be happier and this is the type of phone that I will continue to buy and save my big bucks for more important things.
Negative,excellet phone
Negative,I had no problems using it out of the country.Will buy it again when traveling to Africa
Negative,Good so far
Negative,excellent phone
Negative,Amazing phone especially for the price. I love it and use it in my AT&T plan.
Negative,"I am a Georgia Resident (USA) and T-mobile User.. I am tired of paying ridiculous prices for new phones and having them break all the time. Warranty is too expensive and only cover a couple of times. And half the time buying an older or used phone it ends up having something bad that I didn't know until long time use or it dies on you. So I though I would give this a try. The quality of these phones are actually decent and they work really well. They do not have the Bloatware (T-mobile apps, AT&T Apps, Verizon Apps, Etc) that most phones and thus makes it seem fairly fast. Long time I am not sure how long these will last but at a range of $200 or $300 for some, it is not life or death if they fall and break as compared to those $600-700 phones that you get in the store. This one in particular made it good for the screen size, similar to my S6 Edge. The only difference is quality in screen but it is still fairly different. If you are trying to the latest phone, at half the price, just compare the specs of these phones (RAM, PROCESSOR, STORAGE, BATTERY SIZE, ETC.)"
Negative,Worth for money
Negative,I can not get Facebook to download. I keep getting error 504. The whole reason I got the phone was for Facebook. By by blu.
Negative,great
Negative,"Very nice phone! Good quality for the price! Good size, speed, battery, apps, etc."
Negative,I really loved this cellphone
Negative,I'm not sure about this phone but I had to send it back because I could not hear when ppl called me the earpiece vol is very low even when I turned it up to the max
Negative,"I give 5 stars because the performance of this phone is excellent having in consideration the price,LTE,OS lollipop ,fast respons etc.No complaint for battery and camera didn't expected first quality for the price I paid"
Negative,This phone sucks..the ear piece is low...the battery is terrible... The key board is just said ...when u trying to enter a card number or even when texting it types n the wrong letter or number...I'm scared to purchase another ...do anyone have and idea brands to buy for straight talk services I had this phone for two months now the speakers out smh
Negative,Nice phone
Negative,"This phone has a nice large screen, camera is good, speaker is phenomenal. The phone is pretty (not important but still worth mentioning). It comes with a protective case that is color coordinated to the phone. It comes with a screen protector. This phone is absolutely wonderful especially for the low price. I would definitely recommend this phone, and am considering buying another as I bought this for my daughter. If you are budget minded and want a nice phone for a pay as you go or no contract plan this is the ticket!!!"
Negative,awesome phone love it and highly recommended to buy this product.
Negative,This phone suck! !!
Negative,beautiful and working good
Negative,"Packaged well, easy to use, so far, so great!"
Negative,"Love phone. Easy to work. Haven't had chance to get straight talk yet, so will have to see bout any issues regarding this."
Negative,Excelent
Negative,Just great
Negative,I love the phone 😍
Negative,So far so good. Love the video and sound quality! Fast and easy. Pictures look great but im not a picrure fanatic either. But the touch screen is hard. Have to tap multiple times. Overall well worth it for my budget.
Negative,Top demais recomendo
Negative,"I purchase it for my friend, she like it alot thanks."
Negative,Great phone for less money. Why get an apple or Samsung device when this will do everything.
Negative,"Here goes a realistic review:I spent approximately 2 weeks researching a budget friendly replacement to my iPhone 5s that took a swim with me. I am over making payments to a device that needs warranties and all sorts of addons so an Android phone in the range of $50-$150 seems reasonable.I looked into EVERY brand from Nokia, LG, Motorola, Chinese brands, and finally the American company BLU. To be honest, I was trying to avoid BLU. I felt as if since it were an American manufacturer supported heavily by Amazon that there was some sort of catch. A lot of reviews I read for other BLU devices also scared me by talking about OS malfunctions and poor performance. This is the only BLU phone with excellent reviews across the board in my budget range.Here's my thoughts so far. The device looks fantastic and runs the latest version of Android, which isn't terrible coming from a long time iOS user. I will say that the hardware in this 5"" phone makes it operate smoothly. With an extra gigabyte of RAM it could be even better but being that its a sub $100 phone it's great! I spent the first few minutes uninstalling the Amazon Apps (obvious partnership) and configuring the settings to my liking.PRO:- 5"" display with good resolution and OK brightness- Smooth interface with little lag or freezing- Lightweight- Acceptable placement of volume and power buttons, although I think there are better places to put them- Dual SIM for both personal and business lines which can have different ringtone settings for each.- Excellent Bluetooth connectivity- Comes with a case and screen protector as well as the standard charging accessories. All quality material.CON:- Battery life is not to my liking. I fixed this by keeping the phone on a lower brightness setting. It seems this is the major cause of battery loss.- Needs an aftermarket APP for the camera. The default camera app is OK but the image quality is fairly low even in optimal light. An aftermarket APP made this problem go away and luckily can be set as the ""default"" so the better APP can be launched from the lock screen.- Notifications: This phone likes to tell you everything it's thinking about. It alerts you every time it drops a percentage down of battery from 10% to 1%. I couldn't find anywhere on the web or within the phone settings to stop notifying me. Not a huge con but more of an annoyance.Conclusion:I'm a person who needs a phone for calls, texting, email and the occasional web browsing. I'm not too sure if this is the phone for games and tons of use but this phone is fantastic at it's price point. I would recommend this product to anyone in need of a cost effective smartphone."
Negative,first week awesome after that phone would lose charge fast and soon stopped charging all together
Negative,The product came faster than expected and I recommend it.
Negative,everything was as expected
Negative,"Not a good buy for me, have to return it to Amazon. I tried buying a TMobile or ATT sim card on line and after entering the IMEI number received the message that the IMEI isn't valid and that the device is unusable and I should buy another device."
Negative,"Incredible, it exceeded expectations. 5 stars..."
Negative,"I purchase it for my friend, she like it alot thanks."
Negative,"very happy with the product, price and shipping"
Negative,A very good stock Android
Negative,Id like to send back
Negative,purchased for my husband and he is really pleased with it!
Negative,Power button fell off after a month.
Negative,Excellent value.
Negative,excelente
Negative,Does well for sub-$100 phone. Nice look and feel for the price.
Negative,8Gb internal memory is a lye. It has little more than 3Gb.
Negative,Excellent
Negative,Great Seller! Excelent Smartphone!
Negative,Worth for money
Negative,"This phone is s***. The layout already is bad, with the keyboard taking up over half of the screen when you use it. You will most likely have to search around and find a keyboard app with a smaller keyboard. Secondly, this phone's touch response is way off. For example, in Snapchat you can forget about drawing letters, or anything for that matter. This fluke also effects your typing ESPECIALLY if you have Swype on so typing anything will take 10x longer. I normally use excellent grammar and spelling but this phone has reduced me to using slang like ""r u"" and ""2morro"" because it's just not worth the stress trying to type a nice message. Also, this phone's battery heats up very quickly, which makes the phone crap out. This phone already is very glitchy, so someone with little patience should definitely not buy it!!! Once the battery heats up though, it gets much worse. Sometimes this phone even shuts itself off. Over all, this phone is just terrible, and not a good investment unless you're ready to pony up more money in a few months for a better phone when this one drives you insane."
Negative,I am very disappointed in this phone I have had three and they are all bad says 4glte it's never had LTE it takes 18-24hrs to download an app
Negative,Good
Negative,It is a good product for the rate it is offered on. At this rate there are no other mobiles that offer these features. Also the mobile is really good.
Negative,"This phone is OK. My only problem is that the charger does not work right, and the power button doesn't work ...every time I need to view my messages an push the power button it doesn't turn on always have to plug into charger real quick than take out to see the screen light up ...but it died completely an its says fully charge but when I need to turn on the phone by holding down on the power button it isn't turning on ...."
Negative,very good phone
Negative,"I've litterally had to get a replacment, because the phone would literally stop working on Facebook, and the browser. This happened so much, that I consistently called my phone carrier AT&T to see if this phone was really compatible with my carrier. Turns out it is. Back to the point though, the phone literally would stop working throughout the day, that I literally have to cut of the data connection 2x, then power it off/back on. This is constantly having. Even so with my replacement. Is it only the white Blu Studio C 5+5 that's acting up. Does the black Studio C 5+5 by far work better than the other colors? Or is it just the white one that's messed up, and the rest works perfectly fine. Just not white.Pls respond back to my last question guys. ""Does the black Blu studio C 5+5 work better than the white Blu studio C 5+5?"""
Negative,"Love this phone! Very quick response, beautiful screen. Comes with a screen protector and slim style case both were easy to install. Hoping Amazon will stock the BLU cases for this model."
Negative,I love my phone
Negative,Pretty good phone 👍
Negative,Works great
Negative,It is as expected and better. Thanks
Negative,I love this phone. It does all I want at half the cost of the big name phones.
Negative,"Got this to replace my old BLU Advance that quit. This phone is big and it's really easy to see the screen. The camera is also a lot better than on the old phone.By the way, BLU stands by their products. I called BLU customer service and they offered to fix my old phone since it was still under the 1 yr warranty. I sent it in and they couldn't repair it, so the sent me a free new replacement! I bought this new one anyway, since I wanted a bigger, better phone. But now we have a smartphone that my kids can play apps on without bothering with mine."
Negative,excellent product fast shipping
Negative,Purchased two of these a month ago. So far so good. Works excellent for the price
Negative,"Pone cannot share internet services without the use of mini usb. Speed dialing is headache.(Butt dialing all the time).Picture quality is appalling. Easy to get dirty, Sound fluctuates, I will not recommend this product unless you cannot afford a better phone."
Negative,Cool!
Negative,"Excelente, I love this cellphone"
Negative,Phone crashed after 2 weeks.
Negative,while in use or stand by this phone will be warm or hot killing the battery mine died with in 2-3 hours or just sitting there doing nothing from fully charged to dead I don't thing its the battery I think is the phone is just a power hog even while in stand by its still draining the battery and is always hot do not buy this phone also the 8 gb is a lie there is only 3.11gb available to use
Negative,"Excellent Phone!!!! Love It!!! Has all the newest features, great battery life. Very fast speed time on any search!!! Awesome Camera!! Love the extra features!!! Perfect Pitcutes!!!"
Negative,"i purchased this phone Aug.31 and it said it came with a 1yr warranty. The battery will not hold charge currently and ive tried sending it back have no luck like the warranty does not exist anymore, i am highly upset about this issue, do not buy"
Negative,I'm very happy with this phone. The button on the side feels a little odd at first but other than that it reminds me of Samsung Galaxy S3 which I loved but couldn't transfer from boost to att. I hate all the go phones from ATT but I like the service . This phone is a great replacement for it and for the price you can't beat that. The android system is really good and customizable. I like that it has two sim slots. I'm thinking about getting a second sim for international calls. So far I'm liking this phone a lot.
Negative,I really love my phone it's perfect for me
Negative,Good básic Phone
Negative,"Horrible phone. Very lagging! My son could not stand the phone after 1 week, we had to return it and bought a Samsung S5."
Negative,"I love this phone! I ordered the seafoam green color and it is beautiful. I got the lavender purple and white hard case too. It can play almost any app, the ones that don't work are super high memory, which is the only drawback with the 8 gb storage. You will need an SD card as most of the internal storage is for the system Operations and Google apps. It came with a screen protector, mines lasted since I bought it. It came with a silicone case but I also ordered the case separately from BLU. The hard case with rubbery protective layer will not fit over the jelly case though. It has protected my phone from breaking many times now. This phone is still working great. The only problem I had was with an BLU system update. I contacted them and they were helpful but the only solution left was doing a hard reset. Good thing everything backs up to Google and my SIM card, it made it easy to make it my old phone again. I would highly recommend this phone. It is cheap but not at all cheap quality and does more than I would expect with a cheap phone."
Negative,Good so far
Negative,excellent phone. battery hard enough and not overheat.
Negative,excellent phone
Negative,"Very nice phone! Good quality for the price! Good size, speed, battery, apps, etc."
Negative,great cell!
Negative,Phone started messing up soon as i got it. It won't let me use the bottom corner of the screen.
Negative,Gave as a give since the original person who ordered it changed their mind.
Negative,"Poor man samsung galaxy or htc phone. A good Android phone pretty much do everything as the high end phone. With this devices you can choose any carrier you like without a expensive contract, started at $20 a month. I had purchased more than four different blu phone ."
Negative,Great phone so far..Hubby loves it..
Negative,I got this phone on Friday. I am looking for a new phone already .Very bad phone .The review was good that why I bought it never again
Negative,I love this phone. A few of my close friends and family saw it liked it. The features and the price a big sell.
Negative,Love this phone they even have it all n my favorite color pink happy customer
Negative,very nice phone bundle. was gift . person very happy. he inserted his sim card from his phone that was damaged and this one started right up
Negative,"When I ordered this, the description mentioned that it was missing a small rubber cover. No big deal. It didn't say that the screen was malfunctioning so severely that it's quite difficult to use, or that it crashes all the time. I've now ordered a different phone and will consign this one to the garbage."
Negative,"Well worth the money, love phone and great reception, meets all my needs."
Negative,"This phone complete crap chiiinnaaa. phone,1st month battery reduce to 3 hrs standby ,picture solution very bad and after 5 months completed not charge any more !! Highly recommend DO NOT BUY THIS PHONE.Try it if you don't mind wasting your Money."
Negative,"I hate this thing so much i gave it to my brother in law when he dropped his in the toilet. I hoped he would continue the trend but no, he just uses it for work or whatever."
Negative,I can't say enough good things about this phone. Performance is excellent and the quality vs cost is undeniably one of its best features!!!
Negative,I am really impressed with how this phone works. For a cheap phone it really does have a lot of pricey features.It is super slim. Comes with a silicone case to protect the cornersThe speaker phone is loud which is nice because I use it a lot.It is android based. Has a decent camera. fast enough processor. If you are a tech junkie that has to have the best of the best this is not for you. But if you like to play simple games and use apps like Facebook this phone is perfect for the price.I could not be happier and this is the type of phone that I will continue to buy and save my big bucks for more important things.
Negative,excellet phone
Negative,Nice phone
Negative,A very good stock Android
Negative,I was wondering is if this phone works for straight talk phones
Negative,Very disappointed.... Had this phone only 6 days and now it wont charge....just sent it back...i don't recommend it
Negative,"Perfect phone for the price, check out my review video here: https://www.youtube.com/watch?v=cYYi4YHtPQYYou will not be disappointed in this phone! For a sub $100 phone, I am highly impressed and I think I will be sticking with BLU from now on!Thank you guys for making a great affordable phone!"
Negative,I'm not sure about this phone but I had to send it back because I could not hear when ppl called me the earpiece vol is very low even when I turned it up to the max
Negative,"Let me start by saying the look & feel of the phone was exceptional. I thought I had struck gold with this phone. But I was new to a Android operating system ( I own a I-pad and love the simplicity of the O.S. and it provided me with a rude awakening of what was in store. The ""owners manual"" is one sheet of paper and it starts off with the premise that the ""as delivered"" configuration of the phone need not be explained or instructions need not be provided. hence the phone would only remain ""on"" for a few seconds and then promptly shut down. being ""new "" to Android environment made my situation worse. I did reach ""tech support"" of my cell carrier who markets this phone hoping for some on-line assistance. The person told me I could clear any settings and put the phone in ""OEM"" baseline configuration by a simultaneous manipulation of the power key and some other key which I cannot recall. Doing this did not re-boot the phone as promised - but rather caused the screen to rapidly flash on and off - over and over. When I asked the tech support was this ""normal"" he replied that the phone had ""a total failure"" and was now totally useless. He implied that this was not the first time that this had occurred with this model of the Blu phone. Such a beautiful phone stuck with such poor user manual."
Negative,This phone is an ok model but the storage is crappy.. It freezes every now and then
Negative,Id like to send back
Negative,"First of all I would to say Thank you for the awesome and prompt delivery as estimate. This was the second attempt to buy and give to my mom that live overseas and would live soon..Had trouble get it for for the first time with another seller, in which guaranteeded to get the phone in two days and never seen it. But anyways, The second attempt was just great, had my package on the next day! THANK YOUUU Again!Second, the phone is just amazing so far, loved all the featuresthat the phone has it, and now we are considering to switch up our iphones and Galaxy note to it. Very affordable, great phone, comes with a case and screen protector! So glad I had bought this phone!"
Negative,Great phone for less money. Why get an apple or Samsung device when this will do everything.
Negative,I love it
Negative,Wonderful phone. Exactly what my wife wanted. Packaging was great. Very safe in transit.
Negative,Very good device.
Negative,Very nice my brother like it
Negative,"Well, I ordered this phone to replace my Galaxy S3 that I broke after 2 yrs. working construction. This phone was delivered to my hotel out of town in 24 hrs by amazon, awesome customer service, While the screen and cameras aren't as good as my samsung, the are very good. The build quality of the phone seems excellent after 1 month. I appreciate the lack of bloatware on the phone. When I got home and showed it to my wife, I had to order her one since its unlocked and works in the Dominican Republic(she has a Galaxy 4). In short , its a great phone, lots of quality at a very low price. I would of ordered one of their LTE phones but they had a backlog at the time. Go BLU, great quality at a great price! At this price compared to buying a phone from T Mobile or ATT, I can have a new phone every year at an affordable price!"
Negative,"This is my 3rd BLU phone, Love the good value. Takes great photos"
Negative,"Not a good phone at all, Sorry that's all I can say."
Negative,No complaint yet. I bought 5 haven't no problem from non
Negative,"Great phone, shipped on time. I recommend!!!"
Negative,I can not get Facebook to download. I keep getting error 504. The whole reason I got the phone was for Facebook. By by blu.
Negative,Absolutely loving the Blu's. They are great.
