Negative,"All I can say at this time is, So far so good! It is replacing another Blu 5.5 Studio I purchased from Amazon about a year ago. But after about 6 months, the video started flickering and running lines through it. So when I saw Blu had an updated Studio XL with a 6 inch screen I jumped on it.Although it has a 6 inch screen, Android 5.0 Lollipop takes the bottom half-inch or so of the screen for the ""buttons"" that used to be fixed below the screen. This is a bad move on their part to advertise a 6 inch screen, but only 5.5 inches viewable. So not much improvement over a 5.5 inch smart phone. Also it should be noted that this is not a HD screen. At 960x540 screen resolution, it is subpar with comparable smartphones in this category, but most are more expensive. It has a beautiful screen non-the-less. But for the average viewer, most will not notice the lower resolution unless using it with Google Cardboard 3D viewing. But I'm sure that is a very small percentage of buyers. I inserted a 64 GB micro SD card which it accepted, formatted and allowed me to transfer most of the installed apps to it freeing up the limited 8 GB of internal memory. I then took the SD card out, inserted it into the adapter, then into my computer slot to fill it up with my tunes, pictures and vids. It plays everything just fine with jetAudio basic for the tunes, VLC Player for the vids, and the included apps for the pics.Recommended!Update 4-6-16Using this phone in Colombia & Panama. Works nice with Claro data plan + minutes for 15 bucks a month in Colombia. & 22 bucks a month for +Mas Movil Panama. Good H+ but no 4G so far in either country. MagicJack app seems to have bug, as folks on other end hear their echo. Don't have that with my iPhone 4s. I will reinstall app to see if newer firmware fixes it. Using Speedtest been getting over 10mgs with H+ in both countries. Another problem I encountered when I first arrived in Panama, was calls & msgs seemed to default to Colombia SIM, even when Panama SIM was chosen as default SIM. So just took out the Claro SIM, as probably Claro has overriding firmware to keep it primary in multi-sim phones. Or at least that's what the +Mas Movil tech says in Panama. So the phone is still hanging in there. No real complaints so far. Still recommended!Update 29 Jun 2016Just returned from the Dominican Republic, used Orange SIM & phone worked beautifully. Also just bought from Amazon the PNY 128 GB micro SD card for less than 30 bucks. Removed the 64 gigabyte SD card from my phone, placed it in its adapter and backed it up in my laptop. Inserted the PNY 128 GB SD card into my phone, turned it on. Phone recognized the new card right away and asked me if I wanted it formatted. Which I did. Turned off the phone removed the new card, placed it in its adapter and put it in my laptop to copy the data back to the new card. Inserted it back into the phone and turned it on. Phone recognized it immediately. So no problem with 128 GB SD card with this phone! More tunes, plus just about every picture I've ever taken!Update: 3 July 16Bought from Amazon the Anker double fast charger along with a six pack of their charging cables. I recommend you don't use that Anker charger with this phone. I had missplaced my original Blu charger and cable and began using a cheap generic charger & cable, but was taking forever to get a decent charge. Maybe 60% overnight. So bought the Anker combo pkg. Works super fast charging this phone, but stops at 99%. Phone started acting up which I determined was due to overheating while charging with the Anker charger. Long story short, found the original Blu charger, and am sticking with it. The Anker cables work great with the Blu charger as does the original Blu cable. Blu charger charges in about 6 hrs to 100%. Stick with the Blu charger and cable!"
Negative,"I'm upgrading from 1 star to 4 because of the high customer service extended to me by [..]after I wrote the following 12 days ago......I'm giving one star because the option for 1/2 isn't available. If you don't mind buying a phone that works perfect for 6 months than starts acting up in every way possible including shutting down for a few days, no longer swipe to take calls, battery getting extremely hot, then this is the phone for you, I bought 3, one fell and the screen shattered and I cant get it repaired, but whats the use I 'm sure it would be behaving the same way as the other 2.BTW I also bought a Pure Life XL that unlike the Studio XL's locked it self down once for 2 days with the battery running very hot, from then on I've had no further problems, Bought all three XL's for 360.00 so I'm figuring I got my moneys worth. A year would have been better"
Negative,Good
Negative,The phone over heated and cracked the screen and doesn't work correctly anymore if i wanted a phone that did that i would have bought the note 7
Negative,Waist of your money don't purchased this item
Negative,This is the best phone ever!!! it's fast to the touch and it responds to all my apps the price was right with this also it looks really nice😱 I love it 😃😊
Negative,Awesome
Negative,I was super pleased with the phone and I will definitely be getting more.
Negative,"Love this Phone. AMAZON youre the one. Great product, Great service."
Negative,"Great phone for its price, really recommend this phone. The only thing I can't fine good screen protectors, and cases. Over all great phone."
Negative,"This is a good smart phone , i liked .. its fast, big and conforable !"
Negative,"I WAS SO EXCITED WHEN MY BOX CAME IN, WHEN I SAW THE THIS PHONE IM NOT HAPPY BECAUSE IT GET CRACK BOTH SIDES. MY OLD CELLPHONE WAS BROKEN, SO I DID NOT RETURN IT."
Negative,it's a great phone and very beatiful
Negative,Excellent choice
Negative,"This phone here is Beautiful however that is all it is... now after 5 weeks it drops calls, it says have insufficient funds to place calls which are LOCAL.... The volume suddenly decreased on it's own. and the list goes on. Just tried to return it because I have had it with this phone and I am a week and a half shy of my return time. smh. sucks...... I really HATE this damn phone right now. I am sooooo upset."
Negative,It's good all around no complaints
Negative,Very happy for phone set up and performance.
Negative,Was told this item was unlocked. Phone is not unlocked to work with Verizon in the US. Going to try to return this. 8/ Shame. Would have liked this product probably. Really fudged a birthday.
Negative,Garbage phone
Negative,"This has been a really great phone so far. Just a little bigger than I expected, but it functions very well. Bold Like Us....(BLU) great job!"
Negative,EXCELLENT
Negative,"After my kids have great success and lots of fun using BLU Studio 7.0 II -Unlocked Smartphone - Global GSM - Gold, I decided to finally upgrade my own SmartPhone. I have used my trusty Samsung Galaxy Mini S5570. This phone is small by today’s standards, and I got it for less than ~$40 but it has served me well for four years and it’s still chugging along “decently”. However, AT&T signal seems to be weakening and at times, I will completely lose signal while my wife’s iPhone will still maintain full signal. So I decided I will be upgrading, and I am looking for a replacement that will last me as long, if not longer.FULL DISCLOSURE: I USE MY OWN MONEY WITH THE PURCHASE.Since BLU’s 7.0 version is well liked by my family members, I decided to look for another offering from BLU. My gripe with the 7.0 is that it lags a bit in some games, but never bothered the primary user so I know from the start that I will not be buying it. I was torn between the BLU Energy X Plus Smartphone - With 4000 mAh Super Battery- US GSM Unlocked - Silver and BLU Life 8 XL Smartphone - Unlocked - US GSM - White. As I ponder about my replacement, I began to prioritize my needs:• Must support my current mobile carrier / GSM• Must be at least 5.5 screen size• Must have Lollipop OOB or later• Must have at least 8GB (about 5GB usable internal) storage• Must have beautiful decent display• Must have decent battery life (all day usage, ~12hrs active use between call/text/video)• Must have SD Card slot• Must have FM radio• Must be able to support my game without lag (DISNEY Tsum Tsum)• Preferably with two cameras: Front and Rear (at least 5MP rear)• Preferably with Dual Band WiFi• Preferably Less than $200The only reason, which I know is minor for most, that I chose this over Life 8XL / Life is because both of these phones are on Android 4.4. Of course, Amazon says those phones are Lollipop upgradeable but I’d rather not wait. So other than those reasons, I came up with Studio XL as my choice phone:Specs:= 1.3GHz MediaTek Quad-Core CPU= MALI 400 GPU= 8GB Internal memory [~5.3GB available] / 1GB RAM / MicroSD support up to 64GB= 6” IPS+ 540x960 (183 ppi) qHD Display= HSPA + 21Mbps / 3G / 4G (No LTE)= 3.00K mAh Non-Removable Battery= 2MP Front & 8MP Rear Camera= Includes Headphones, Screen Protector, Case, 2 Amp Charger, USB CablePlus+ Great value as a phone and tablet (phablet)+ Android Lollipop 5.0+ Factory Unlocked for GSM+ Bright screen+ Great Battery Life+ Fluid UI Performance+ Expandable StorageMinus- Single speaker- No accessories *yet*- Back Slot Cover is very very very tight to open- Resolution is too low even with higher PPIImprovement Required:* Better display, with 540x960, BLU has greatly reduced the sharpness of the videos and pictures displayed on the phone.* More RAM (at least 2GB)* Support for LTE* 5Ghz WiFi Band* Smaller bezelVerdict:I like this phone, and I tried to LOVE it. It is gorgeous, has great battery life, and performs like a champ in the games. It’s even better than the BLU Studio 7.0 II in gaming. The Phone performed as expeted with Speedtest both in mobile and WiFi. It maintains a strong signal (AT&T Prepaid) even on areas where my Samsung completely lose all signals. I like how the phone feels, and it doesn’t look cheap. I really like that the phone came with screen protector, and protective case.My biggest issue for this would be the resolution, as the longer I use it, the more I notice the low resolution. In the end, this is a great device as a main phone with huge screen and worth the money."
Negative,I wrote a review when I first had the phone. I was happy with it. After almost 3 weeks the touch screen is starting to not respond properly. The time keeps changing to East coast times. AT&T can't even figure out the issue. My data seems to drop in the middle of task. I am sending this phone back.
Negative,Switches language on it's own while typing. The screen is irresponsive. Won'tscroll. Topless 2wks torta ir amor educarte btbthisbisbthebty. Switched me again. P.O.S. took me 20 min to type this!
Negative,awesome as my daughter says
Negative,Phones are great!!!!
Negative,It's a really good phone better than I expected
Negative,"This phone is absolutely wonderful. Performs just as well as the expensive guys. Beautiful camera. Love that there was no need to buy accessories. They all came with the phone, including a case. This is a great buy!"
Negative,Nice phone came completely dead take a while to charge
Negative,Unsatisfied
Negative,It doesn't look like how it is
Negative,"Beautiful phone, preloaded with Google app. Price is exceptional great. I had already purchased another one. Plan start $20 and up, no expensive contract."
Negative,Had to go with AT&T but satisfied with the phone
Negative,I've bought a few blu phones I think 7 of them and this piece of crap is the worst can't even hold a phone call without dropping it with full bars.. Very disappointed in this model
Negative,I totally love this phone and the price is unbelievable deal for such a phone. The only draw back I can see is there doesn't seem to be a lot of cases for this phone. However it did come with a thin plastic one. I was able to put my card ( T-Mobile prepaid ) into phone and it worked right away.
Negative,I return this phone it was a good phone until it started to malfunction I can't get a refund on this item I sent back so I quess its a lost for me
Negative,A+++
Negative,He's love it. I purchased it for my boyfriend as a gift
Negative,This phone is awesome..everything worked with T-Mobile perfectly except GPS. For some reason the GPS never knows exactly where I am in reference to the turns. It says turn in 3 miles and when i get to the turn it never picks up when im there...so weird...But phone is still awesome
Negative,Love it. Works great out the box!
Negative,This phone is junk. I havent even had it one month and now it wont go past the bold like us menu. I have tried resetting it amd nothing works. Such a waste of money and now I don't have a phone for the weekend. Lessoned learned not to buy one of these phones.
Negative,Received my studio blue xl two days ago. The first one I purchased I returned because my cell phone provider (T-Mobile) said that they couldn't get the internet to work . so i then went to metro pcs and she said that blu brand type phones have a problem with connecting to the internet through their service. So I sent phone back .then something said order phone again. I did and programmed everything myself!! Instead of taking it to store And also it was a icon u had to click on to connect the internet. Everything works prefect! I love this phone! Cell phone companies just want u to purchase their phones instead of u bringing a phone from the outside
Negative,Perfect
Negative,"On time arrival, product just as advertised."
Negative,Yes
Negative,This phone sucksIt can't run any games and it is always delayed when I type or when I scroll and every once in awhile the phone just doesn't want to charge
Negative,Love this phone it works just like my other phone (Samsung Note 2)
Negative,"i got this phone, i am with t mobile how ever i dont think my old tmobile sim card work for this one, i had a blu studio 6.0 any suggestions on what kind of sims cards i need for this for phone and is there on here i can buy ? info can you comment the name thanks!"
Negative,"Works great. As advertised. 2nd BLU I have owned in 3 years. Plenty of storage for all popular apps and then some. Can't beat it for the price. Get it, you'll be glad you did."
Negative,"I Love this high tech phone, it's just as great as an iPhone."
Negative,I have had two of these phones since January 2016 and neither one works. I will never buy this phone again. I can not return it to Amazon now and that is not fair. Maybe I will reconsider keeping my account since I was treated unfairly.
Negative,Nice Phone
Negative,Great phone for the money.
Negative,"Good battery life, solid design.... Be aware only uses a Micro (phone) and Nano SIM cards (storage). Finding after-market screen protectors is a pain. Few cases available."
Negative,Great phone for the money.
Negative,everything perfect excellent product recommended
Negative,Good phone for price.
Negative,Excelente
Negative,bueno
Negative,"Phone has a ""plastic"" feeling but I like the screen size. Good hand held size and feeling when holding it. But one major issue is that it didn't recognize my t-mobile or lycamobile SIM card. Both SIM cards work fine when I tried with other unlock phones. But this phone just reads ""insert SIM"" and ""Emergency."" This phone is faulty because it can't read my SIM card but I read other comments and they said it works fine with t-mobile SIM card. So, I don't know what's the problem. I'm going to contact seller for replacement or return and also contact t-mobile. I'll update once this issue is resolved either way.UPDATE: Returning this item. I called t-mobile and the tech guy said it's due to the phone not properly unlocked so it doesn't recognize any SIM card. The Blu phones do work with t-mobile but how can you tell if it was properly unlocked. I'm going to get another Blu phone from target or walmart where I can return it in-store. Hoping they have properly unlocked phones there than here with the different sellers at amazon."
Negative,exelente
Negative,"for this price tag ,you cant ask for much more. works as described, long battery. no issues so far. had it 6 months and its done USA, UK and Caribbean without skipping a beat"
Negative,Garbage. This things keep turning off on its own. Not worth anything.
Negative,Gr8 phone
Negative,exlente
Negative,excelente
Negative,"Bottom Line: It's a cheap phone and made & handled by manufacturer like one. You WILL get frustrated and the phone does NOT justify even the low price tag.Interested in the story?Like most others, I got this phone for the low price - I just wanted it as ""spare"". A few weeks after the phone arrived (in May 2014), I realized one of the SIM ports didn't work but I didn't bother because I needed only one. Another month or so and the last remaining port also stopped working. Well, fine! I will contact customer service and they will help, right? Nope! It is a cheap phone, it's built like one and also treated that way by the manufacturer.Many email exchanges to prove to them that a) the phone indeed doesn't work, b) those SIMs do work in other phones and c) send them invoice, phone IMEI details and waht not. Fast forward a few weeks and they asked me to ship it to them - WITHOUT A SHIPPING LABEL! The cost of the the phone immediately went up by 15$s! Well, ok! 40-odd $s for a spare phone is still not too bad.Add another 2-3 weeks and I was notified I will get a new phone. Fast forward to early this year and I receive another notification that the phone was undeliverable and I'd have to pay 10$ for them to reship it! When i asked them the question - about the cost of all this becoming more than that of the phone itself - I was quoted ""company policy"". That was the end of that as I decided to save my 10$s. My final message to them ""Please feel free to keep the phone. I am not prepared to spend another 10$s (hence totaling 50$s) on a phone that was initially for 25$s.""Add to it the hours spent on email and postage and the cost of not having a phone...."
Negative,"This is a wonderful masterpiece of 21st century's high technology. I've got a tv receiver that works so great I feel I'm living in the Jetsons cartoon world. I am very glad with my tv cell phone and the good service provided by Amazon. I highly recommend blu because truly delivers quality at low cost. Buy this device, it is the best analog tv ever."
Negative,Simple and cheap
Negative,Thank you so much we badly need this kind of phone and working great!
Negative,fino
Negative,Fine
Negative,has a horrible humming noise and can not get a hold of Blu
Negative,very good
Negative,excelente
Negative,very good article thanks .... Recommended
Negative,cool
Negative,Excellent
Negative,Excellent...
Negative,"I purchased this phone strictly as a backup while I'm between smart phones. It makes and takes calls as you'd expect, but unfortunately, no matter how hard we try, it's impossible to stop the barrage of text and multimedia messages. A simple multi recipient message was all it took to make this phone go completely crazy.The phone does not have facebook and social media functions like the description said. Again, it's just a backup, so that's OK. The TV function doesn't work. Again, just a backup phone, so no loss. It doesn't recognize all my ringtones. Again, it's a backup... you get the idea.Where I drew the line was when a simple message caused it to receive gibberish text messages at a rate of two to three a minute. I could no more put the phone down than it would ring again, and there would be more gibberish coming from the same source. Adding that source to the phone's blacklist did nothing to help--the ""messages"" came through even FASTER.I plugged my SIM cards into an unlocked Android, set up the APN, and the group message showed right up as it was meant to.IF you can convince your friends to never text you again, maybe this phone would be a good choice if you wash your Android like I did. IF you could disable text messaging on this phone (or through your provider), then maybe this would be a good spare phone.If all you want is a simple, basic, phone that makes and takes calls, then go buy that phone over there instead."
Negative,"I needed a phone while traveling overseas. This thing is absolutely perfect. $29 shipped, are you kidding?Takes pictures, has a rather good FM radio, holds the charge fantastic, and most importantly it's a telephone. Takes two sims and a memory card. Yes, it isn't a $800 smart phone, but I wouldn't cry for it if I lost it or got pickpocketed. BLU nailed this one. For $29 it's an easy 5 stars."
Negative,"For those of you looking for the most basic features in a phone, you can hardly get any more basic than with this phone. I bought the BLU Tank 3 T430 for its lack of features, long battery life, and low price. It doesn't have anything I would never use in a phone.All I want is to place and receive calls and do simple texting. It has a one-name-one-number contact list without the possibility of adding a birthdate, email, or other useless information. I really like its blacklist feature.I first transferred my contact information to the SIM card using my old phone before inserting the card into my new phone. Once the card is inserted, you can copy your information to the phone's memory. I just left my contacts on the SIM card since SIM cards have a capacity for 250 contacts, and this phone's memory is limited to 100 contacts.It has an FM radio which is nice to have, though unnecessary. It has an auto search feature which will pick up all FM radio stations in your area. You can then edit the name of each station if you wish. Don't count on quality pictures and videos with its VGA camera. It can play audio and video files located on a mini SD card.Opening the back cover is easy if you can get your fingernails in the slot located on the lower right side. It's easy enough to insert a SIM card in the SIM1 slot using the metal tray which has a pull tab on its left side. I didn't try the SIM2 slot. The battery has no pull tab, but comes off easily enough. There's a slot for a mini SD card which you will need to insert should you want to take pictures and videos.Overall, I'm very satisfied with my new phone. It has fewer features than my nine year old flip phone, but one major plus with this phone is that it has no moving parts other than the keypad buttons. I like its big display area, pleasant colors, and loud speaker. I recommend it to anyone who is not technical and has no use for a smartphone, and to anyone who travels frequently. Its dual SIM card capability means you never need to open the back cover again."
Negative,"Opened the package, turned it on and tried the functions. Within 1 minute it caused me a headache (physically), so I returned the phone within 5 minutes. Had to pay for the shipping, though. I am not going to buy any unfamiliar phone brand online since there is no way to try it."
Negative,"this phone is amazing ... It is super fast, good design ... I made a good buy. the only problem is the battery"
Negative,"Took to T-Mobile for Sim and the agent was floored by the value of this Phone !This phone performs like phones twice the cost, has amazing features and an Outstanding package.Android 4.1 and works 3G on T-Mobile right out of the box.have tested most of the features and it is as billed Flawless phone and service!Missed T-Mobile after being on hind tit Sprint (Virgin) never never again..Nothing but Smiles !!Edit: Battery life is 48 Hrs. + fairly heavy first days use."
Negative,ok
Negative,Good Phone and Perfect Condition
Negative,Excelent product
Negative,"I bought this for my father who just needed a basic phone. He loves it, it works well and AT&T had no problem helping him set it up. As written by others, the manuals are fairly useless and are written in a micro-font. They don't have all of their manuals on line but I managed to find one close enough that I was able to email him and he used that. So overall the product is great but the documentation not so much."
Negative,"The phone just works!Pros: Long battery life, simple, light, easy to use, loud and clear.Cons: Plastic is not the best, menu could be more logical.Overall, it's a great phone. Once you figure out the menu system and don't drop it."
Negative,excelent
Negative,"The phone just works!Pros: Long battery life, simple, light, easy to use, loud and clear.Cons: Plastic is not the best, menu could be more logical.Overall, it's a great phone. Once you figure out the menu system and don't drop it."
Negative,Received on time and works fine.
Negative,it is good
Negative,Excelente
Negative,DOESN'T WORK ON CRICKET YOU LIARS
Negative,👍
Negative,excelente
Negative,good
Negative,"Bought this phone to use overseas and it worked perfectly. Just inserted sim card and it worked like a charm. I didn't need a lot of apps so it worked for the basics. Would not work for viber, whatsapp and other such apps."
Negative,"Item received. Phone is unlocked on description.I have an international sim card, but I get an ""invalid sim"" on the screen when I turn the phone on."
Negative,"Well, but its performance are limited"
Negative,Very nice with cheap price love it
Negative,Not bad
Negative,Very mobile
Negative,"Now I have not used it yet overseas, so I don't know if it will work. But I think that will have more to do with the SIM card than the phone itself. It picked up the local network and works fine. Inserting the SIM takes some finesse and fingernails but is not too difficult. The buttons have a good feel to them. The radio is surprisingly clear for FM. Play around with it and you will eventually figure out how to make things work."
