Positive,"I won't go into deals about the phone because I think others have done really good reviews (read reviews from the gray phone as well) but I will go into details about my experience.Here are few things I want to focus on:1- INTEGRATION: what I mean here is the integration between apps and the main functionality of the phone. I use the calling feature a lot ( expected ) but also I don't want to launch each individual social app to find someone I want to SMS/Chat/Call. Basically it has a ""universal"" contacts so if you use Tango/Viper/WhatsApp/Skype/Google Voice you will find it so easy to find the person and do whatever you want. I make lots of international calls so I use 3rd party app to make phone calls (along with GVoice). I've used this 3rd party with the iPhone but it was buggy and it always crashes plus I have to launch it each time and find a person to call. With Android, I can just configure the app to be used when I call internationally. The same goes for Google Voice.2- NOTIFICATION: I use social apps like WhatsApp alot but with the iPhone it used to drain battery and not work properly with the iOS notification. I've to open it all the time to make sure someone is talking to me. The notification for this phone (probably Android thing) is just amazing. With the power and memory of this phone, all apps just push their notification smoothly. Slide down with your finger from top to bottom and you see all your notifications. It could get annoying but you can always turn it off or silent your phone.3- S-PEN: As others have mentioned, this is probably the best part of the phone. I can't imagine not using it and believe me you will just love it. It has so much features and is very precise when writing. I use it almost all the time.4- BATTERY: I charge the phone at night only. I use it from the time I wake up till I charge it again at midnight. I won't exaggerate if I say that I use it heavily from sending emails, to lots of FB to youtube to all social apps (Skype/SMS/WhatsApp/Viper/Tango) to email and lots of browsing and it will survive till the end of the day. The screen is almost on 75% of the time. I have to say that while it is not a PC but I've not used my PC that much since I got this phone.5- SPEED: with all the points above, switching between all the apps I work with is just blazing fast. No lag whatsoever. It is very fast and loads quickly.6- MULTI-TASKING: You can literally use two apps at the same time (not all apps though). Just drag an app from the side menu to the screen and it will split both ups (top and bottom)7- AUTO-COMPLETE/SENTENCE COMPLETION: it is so amazing smart I literally type few letters and it gives me so many options to finish. It also predicts the next word based on your selection and you type a 15 words SMS in 5 seconds. As an FYI, it does this for more than ONE language I use (English/Arabic). With the iPhone, it was really a piss off. Each time it overwrites what I type and I keep hitting the erase/back key on the keyboard.8- CONTINUOUS WRITING: For both languages I use - again - I just move the S-PEN (or my finger) on the keyboard and it will accurately finish words for me. I am honestly surprised at its accuracy. About 90% of the time it is always correct. English accuracy is higher than when I type in Arabic.9- SIMPLE MOBILE/T-MOBILE: I live in Northern VA and there are so many new towers with the 1900 band. However only when I am next to them I get 3G/HSPA+ but the speed - while driving; I know :) - is about 5.5Mbps down and 2.5Mbps uploads. 99.9% of the time I am on EDGE. I might move to Simple Talk but to be honest I do a lot of SMS internationally. If Simple Talk will cut off my line when sending couple of International SMSs then that would be crazy. The majority of my time is at work or at my home. At work I use the PC so I don't care about 3G/4G while at home I use my Wifi. At the end of the day, you need to really evaluate your needs. EDGE is more than enough for me for email/light social apps.10- TABLET ALTERNATIVE: I would only use a table for reading books since I've 100's of technical PDF books. I've read few large Apress PDF technical books and I can see myself reading from this phone straight. I don't think it will be ideal but it was just so hard on the iPhone since I was constantly zooming in and out.11- FINGERPRINTS: I am not sure if I read some reviews that said it does not get fingerprints easily but this is not true. It is like a magnet and don't listen to their reviews.Finally, I was lucky to get my two phones from Amazon LLC and not a third party seller. I just don't trust these guys for the amount I paid for my phones and I was lucky to get the last two white ones. I've really enjoyed the phone every time I use it and it is worth every penny. I don't think I need to jump to any phone for few years to come (unless I break this, hopefully not).Finally thanks to all the previous 5-star reviewers here at Amazon. They've done really a good job giving this phone with it deserves."
Positive,"Purchased this lovely cellular device for my mother, she loves it, only thing it resets itself when you turn it off but it might be her phone provider that does it. Anyways it's a good phone for anyone. Long battery life."
Positive,Ive changing phone a lot but this one ive use kt 8 months then i change it for an iphone 5 (huge mistake) android phone are the best ones
Positive,Best phone i ever had. Completely satisfied. Fast delivery. Very happy. Dont have 1 single complaint. Cut my straight talk sim from a google search template. Installed perfect. Works great. Even got flashplayer and pdf reader installed.
Positive,Grest product and excellent customer service. Since I brought the product I havr not had any issues eith it. The company I got it from went out of their way to even provide me with an adaptor.
Positive,wow it isbest greatest best smartest phone ever.I choose that so many people recommend me to have this.I really feel so gooooooooooooooooooooooooooood having this phone
Positive,Le doy 5 estrella porque es una maquinaMe gusta por que el teléfono es otro nivelLo recomiendo por que le va a impresionar
Positive,I just LOVE this phone..everyday I discover more ..It is everything I need in one complete package.Service from the shipper was amazing..I had it shipped to a friend at a hotel who was bringing it to me..I worried about the time frame and emailed the shipper...they responded immediately and said no worries! It arrived on time ..
Positive,"Spectacular, as you can read elsewhere. Some things I like that don't get talked about as often as others: - removable battery. About $20 to get a spare battery and charger. Don't plug in, just swap batteries. - standard cables. Inexpensive - Strong, thin back that you can rip off and smear back on every day without damage. Makes for a light phone that's less slippery."
Positive,"A_Mazing! This is the best phone/tablet I've ever had in my hand by far. Thinking about it? Buy it. The features are futuristic, and it's lighting fast. I ordered a straight talk sim, and it was plug and play."
Positive,I do have one issue the OS does not allow to install apps on microSD card hope that OS updates will resolve this issue
Positive,"it's a great Phone, I like it...it's fast, it's really cool, it's good for business, good for internet, good for every thing..."
Positive,A very interesting and enjoyable phone. The best of the galaxy generation so far. I am using it as a phone and also as a computer. The price is expensive but it is worth it. This is my second phone of the samsung galaxy generation after the galaxy s2.
Positive,"I've had this phone for about 2-3 weeks now. I'm coming from using an iphone 3g so it's hard for me to compare to it's true peer the iphone 5.Pro's- Large screen, lots of apps, good touch response, good rear speaker, quick processing power.Con's- It's take a while to handle it so you're not activating something on the screen. Also the power button on the side should be moved to the top like and Iphone. Not sure if thats some sort of patent thing, but it just adds to one more button to accidently pushing during handling. Also IMO...all buttons should be more flush with the body to help prevent accidental pressing. These button stick out just enough to be accidently pressed during handling. I just didn't have this problem with an even smaller Iphone.I haven't used it as a phone yet because I'm overseas and will be returning home soon. FYI, it uses a mini sim card. What I do like is my computer picks up the phone with no issues like an external device so makes transfering files easy.I find the stylus pretty useless. The few times I have used it, the action isn't very responsive. Maybe I'm using it wrong?Another problem I don't like is when I'm texting in landscape mode, the keyboard takes up the whole screen except for the line on top I'm typing so I can't easily reference the material above that line. Everything works normal in portrait mode. Not sure if this issue is my phone or a android thing. Maybe there's another keyboard app? Haven't tried.One of my big things is using unlocked phones, and I also liked the size so overall I like this phone and it suites my needs."
Positive,"Great item; but you have to get use to its size. Works well, but you my have a problem finding a sim card for it. But you can find a sim card cutting template on the internet. So service providers will cut one for you if they don't sell them already. With that issue out of the way I am sure you will be more than happy with the unit. Note that many of the apps for this unit can be downloaded for free. That being sad remember that music, photos, data files, and apps eat up the phones memory and battery; invest in an additional battery if you are using the phone to do more than make calls and you will. Also consider getting no less than 32GB of additional memory."
Positive,"I used to be an iphone fan, if you are considering to change to the Samsung Galaxy, dont hesitate, the software blew me away!, same as the iphone 3g did. I could see the rabbit and turtle story apply to Apple and Samsung. Relating to the size, it is perfect for the real multitasking (not running in the back, just in front) , see movies, it is really no reason to have a tablet. Besides I have received a lot of good comments related the screen definition. I am still learning : there are so many details and configuration: besides you can add the 64gb to expand to 80gb if like me buy the 16gb model. Also i use the S pen a lot."
Positive,"If I had known that ""International"" means limited internet in US, and always roaming; I never would have bought the phone.So I sent it back."
Positive,mora than expected I definitly recomend it. if you do t care care size. great for womans we alwYs got a purse so size is no problem at all.
Positive,"I recently purchased this for my wife, whose Galaxy 1 started to become well used. The size is between a galaxy 2 and a 7"" tablet. Basically it is a slightly smaller tablet you can also use as a phone. Keyboard size is good. I got the unlocked version because her service provider does not have this model available yet. Android 4 appears to be very stable, and most of your earlier version apps will transfer.As a plus, this model comes with a built in stylus like the new Galaxy Note 10.1 which is very handy."
Positive,"This product satisfied my expectations, is much better than all others smartphones i had. It seems to be very big but once you get used to it you realize is the perfect size, great native apps the S pen y the best."
Positive,The Note 2 arrived as scheduled and it is in perfect condition. The phone is amazing and I am very happy with my purchase. I have no complaints or criticism with the phone or the seller as everything is just as it was advertised. I would recommend both the phone and the seller.
Positive,"I am so happy I purchased this. I have an S3 but the Note 2 is so much better. The titanium gray finish makes it look sleek and elegant, a nice change from white or black. I use an international micro SIM card purchased from Amazon and it works well. I got online through Wi-Fi and downloads were quick. My apps were easy to install and use. I needed an unlocked international version because I travel around the world and I need a phone that can roam on 2G or 3G networks. I also added a 64GB microSD card for listening to music and audiobooks. I can replace my iTouch and not have to carry 2 devices, plus the microSD card slot lets me carry more than the on-board storage. I like having options and the Note 2 gives me plenty.03/15: I set up my music and listened through my Bose headphones. The sound is great and I can change the ambience to bass boost or I can customize my listening settings. I set up my playlists and the graphics are good quality and brilliant colors. I spent the afternoon taking photos with my Note 2 and they came out great. The quality was so much better than my point&shoot. I also got some video with sound that is amazingly good. Transferring the photos and videos to my PC was easy. Owning this device just eliminated another item I no longer need to carry. I travel a lot and I usually carry my iPad + cell phone + camera. This would replace all those easily. My only two wishes were that it used a regular SIM card rather than a microSIM card and that it came in the same gorgeous garnet red as the limited edition Galaxy Tab 2 7"". I found a deep red flip cover, so here's hoping it will be beautiful. I am very happy with my purchase!04/27: The Amigo flip cover for this device is a beautiful deep berry red. I get compliments on both the case and the phone wherever I go. I'm taking advantage of the daily free Android apps that are compatible. I've gotten some great free apps through Amazon's program.05/16: I have traveled to several different countries in Africa and I have had no trouble using my phone service. Service depends on the carrier, not the device. Some countries do not recognize my SIM card for calls but let me send/receive SMS text messages. My device still rocks! I'm using it a lot more these days than my iPad. I still need my iPad for movies, though, because Amazon Instant Video (download) is not for android devices, just the Kindle, the iPad and the PC. I hope that will change one day because the Note 2 is great for watching video content. I've watched some YouTube videos on this and the quality is execellent."
Positive,"excelente producto, altamente recomendado pues las mejoras con respecto al samsung galaxy note 1 se nota las diferencia mayor rendimiento y fácil manejo"
Positive,este telefono es una maravilla muy rapido me gusta mucho es muy facil de usar realmente estoy encantada de haberlo comprado
Positive,"CANT PUT DOWN my fone! so much to explore and discover!one of the best gadgets/fones i ever had!!Only DOWNER is - i got myself a 64gb scandisk memory bcos by internal memory is just 10gbs - BUT - unfortunately these fones need to be rooted then get download some apps etc...Why cant the fone just give me option to save my apps and media on internal or external memory?Its quite a hassle if you are not a techie type.So now im left with doing all that setting up external memory so that i could download more apps and have space for my media files.otherwise like i said - i love this phone. My bf got iphone 5, but compared to mine - mine is def so much better and bigger.sometimes my bf gets jealous.its really enjoyable piece of gadget."
Positive,"The Note II is a very good CP. It is a very good Tablet. Together they are a great product, The two cams, one front and one rear, is really nice. Can use the front for im and the rear for making movies and taking still photos.If had larger memory is about the only complaint. Need at least 64 GB for the cams.Any one looking for a Tablet or a CP should check this unit out. They are combined into a nice package here."
Positive,I like this phone especially the screen. People say that the screen is huge but you get used to it. It's like a mini iPad
Positive,"VERY GOOD!!!GREAT PRODUCTS, RECOMEND ITSIMPLE TO USEGOOD PRICEGOOD BATERYGOOD 3SIGNALOK WHEIGTVERY SIMPLE INSTRUCCIONSRECOMEND"
Positive,there are so many feature that this phone have that iphone don't and both of them have relatively the same price.I
Positive,"I really like this phone, But it's not fit for everybody. It might be too big to some of you, but that was what i liked the most in this phone, i barely use my computer now! The camera is very clear, very fast phone, i enjoy watching clips and surf the net. Reading and writing an e-mail is so convenient. The only disadvantage i discovered is very easy to break. I dropped it once and it's cracked, so be careful."
Positive,"This is the first smartphone that I bought and at first I'm kind of hesitant on buying an unlocked international version because of some reviews that I have read. Buying this phone is very worth it and I love all of it's feature. Also, the phone arrived on time and in good condition."
Positive,"Best smart phone I ever had. I don't need a tablet.Is just the right size, and the battery life last for 20 hours with heavy use."
Positive,"Happy with the purchase so far. Worth every penny. Had a Nokia N8 for almost 2 years before this so was looking for a major upgrade. Feels a little awkward when taking a call, but barely do that anymore (and usually just use the loudspeaker when I do). Screen is huge and awesome, feels like I've barely tapped the potential of the thing but I already use it for loads of stuff I never thought I'd do on a smartphone (some art, note jotting, watching short clips, music, even get to work a bit with dropbox integration and a latex editor. Highly recommended if you need a powerhouse at the tip of the finger and can embrace the big screen (I grew tired of trying to read on small ones really)."
Positive,excellent phone and good apps available. was interested in the I phone but decided on the Note. no regrets there.
Positive,"The HD Super AMOLED display provides clarity, has a larger screen, but keeps your body lean that fits your hand perfectly. The quad-core processor 1.6 GHz integrated offers powerful performance and the S Pen offers several additional functions."
Positive,"OMG I love this phone, I will never change it. Fast deliver and good product. I recieved it even before the time that was in the order. Thank you for the good service"
Positive,"A few months ago I purchased a note 2 from this seller and everything was fine. Since I had a good experience with them and needed another note 2, I decided to buy another one from them. Unfortunately the person who was going to use it in my company did not need it so I asked to return. Not only did I have to pay for the return shipping, the seller charged me a 15% restocking fee. I understand some fee should be charged but 15% is a rip off. They just lost a customer with me and all my 60 employees.I recommend if you are going to buy a note 2 do so from Amazon just in case you might return."
Positive,"1. I ordered a titanium and got a white one.2. The phone is a used one. I dumped it into the river nearby as it was not what I thought I paid for.The supplier is definitely dishonest!In fairness, Amazon is normally better than this!Carlos G Santos"
Positive,"It surppass my expectations in many aspects! I like the funcionality and the speed, but I dislike the price. I already recomended this product to many friends."
Positive,everything about this is great so far. sharp looking images and error free touch screen. I could be wrong but even the battery lasts longer than my other phone
Positive,Purchased as a anniversary gift for my husband. He just loves it and is enjoying learning and using all of the wonderful features. Works great when we skype too. Is very user friendly and would love to get one for myself now.
Positive,Completely satisfied with the purchase of this product ...!
Positive,"Awesome phone. After 3 yrs, still using mine. Just did factory reset and updated all apps. Works well and the phone is snappy."
Positive,Exelent
Positive,Excelente
Positive,"The phone was great while it lasted which is a little under 2 years. I am unable to fix it due to the fact that it is an unlocked phone - an ""international"" version, Samsung has refused to diagnose the issue for me. So, I guess it's a total loss. It's a shame because the phone was a pleasure to use and very reliable, until now. I expected it to last longer! I'm not allowed to write anything about the seller here so that's all I have to say."
Positive,Buyers be aware!!! Cellphone has not warranty in USA or any other part except in Slowakia . So if you want to buy a cellphone without any support BUY AT YOUR OWN RISK. BE AWARE OF SELLER THEY ARE NOT HONEST.
Positive,"Buy it, at your on risk, be aware you will have no warranty support from Samsung neither from the store.If you open the box and the N7100 is not working or stops to work few weeks after,as happened with my one, you threw your money on the waste.Be always on the safe side, buy hw with warranty.Good lucky."
Positive,I absolutely love this phone. I bought it for travelling originally and now I use it at home too. The only down side is be prepared for the Oooh's and Ahhh's from friends and people when you take it out!
Positive,"Got this for a friend who will be in Africa eventually. He LOVES it, even before getting a temp phone service to use while in the US. He can Skype his wife in SA. She likes the clear picture."
Positive,"I love this phone, it's the best phone I ever own and I recommend it to my friends and they already bought three of the phones, this is a much better phone that the I phone I had. excellent product."
Positive,Good product meet my demand i loc it i wll dedinately recommend it to friends. I got it on time and it works fine
Positive,I love this phone. I can use it for all types of tasks especially for work and school. You get used to the size after a while. Note: Does not allow LTE on tmobile. But you get HSPA+ which is 4G just not lte.....i think. Overall great device I do travel out of country a bit so having phone already unlocked is a big plus.
Positive,"excellent product, what I asked was expected, a quality 100 % , quality at low cost, the finish is spectacular, I recommend this product to buyers, are you going to like, thanks ..."
Positive,I use my Samsung galaxy note 2 for both business and personal. It meets all my expectations for both. I am very pleased
Positive,Well it worked just liked they said buy a micro sim card and thats it depending on your country is 4 g or 3 g it all worksLoved everything about the phone i know its a little big but hey thats why i got it so stop hating on my choiceOpen Group Wireless was the seller and will deff buy again from them by the way i always try to go with Fulfilled by Amazon if not i always get trouble but all my accessories were for the usa version so Im happy
Positive,"I've had my galaxy note 2 for about a week now (sent from Blutekusa of Amazon). It was challenging at first because there was so much to learn and take in. But after going through all the settings and customizing everything to suit my needs, this phablet works beyond expectation. I'm loving it increasingly and it's well worth the money spent.The functionality of it is like no other. Installing and uninstalling apps is super fast and simple. I love that I can Google voice or S voice to call, text, look up stuff, schedule appts on my calendar, send myself memos and reminders, set alarms/timers, etc. without having to type anything down. I love that I can use 2 screens at once. The camera takes beautiful pictures, I was at the art museum a few days ago and the pictures turned out picture perfect. I can simply say 'cheese' or other words and it takes the picture, very awesome. Using the S note and S pen is also very fun and allows me to be creative. The possibilities are endless with this amazing device. I'm very content! I hope to have this for a very long time.The battery life is terrific! After using it a whole day, I'm at just the half way point when I put it on the charger.I only thing I'm disliking right now is that I can't download my picture text messages on Net10's AT&T network.but that is a network issue, not a phone issue."
Positive,"Pros -Best Phone out there.. Hands down.5.5"" of awesomeness.Cons -Folks with small hands might struggle to use the device."
Positive,"This phone is amazing. The size of the phone is daunting to some people, but I am a very large man so it fits perfectly in my hand. My wife and I both bought one and she loves her's as well."
Positive,"this is the best cell phone ever, an amazing big screen and i it s truly unlocked so dont have to worry to be attach to a plan."
Positive,"keep up the good job....is very professional , on time as presume ,TechGiant ,,,you are the best May God Bless you guys ..."
Positive,"Dear Jupiter Sellers,I purchased this phone from you from US Amazon in April 2013. The Amazon description did not explain that it's an international phone with NO US WARRANTY that can only be serviced by a UK Samsung Center. This is deceptive; if you are going to sell phones to US customers, you should explain if they do not have a US warranty. The SIM tray just broke and the phone is not working. Samsung is requiring me to call their UK service center to arrange for service. However because I do not have a working phone, I cannot make an international call! They do not give an option to arrange for this service over email or calling a US affiliate.I would be grateful if you could please contact me to offer to call Samsung UK at 0121 643 7373 to book this purchase for repair, in which case I would delete this negative review."
